{
  "schema_version": "dsh-task-cleaner/audit/v1alpha1",
  "event_id": "33333333-3333-4333-8333-333333333333",
  "seq": 1,
  "timestamp": "2026-09-09T00:00:00Z",
  "task_id": "task-001",
  "run_id": "run-001",
  "phase": "quarantine",
  "actor": {
    "type": "cli",
    "id": "user-001",
    "session_ref": null
  },
  "event_source": "cli",
  "action": "quarantine.request",
  "outcome": "intent",
  "dry_run": true,
  "targets": [
    {
      "rel_path": "out/gen/tmp-123.txt",
      "real_path": "/workspace/out/gen/tmp-123.txt",
      "candidate_id": "cand-001",
      "decision_id": "decision-001",
      "identity": {
        "dev": "1",
        "ino": "2",
        "sha256_before": "cccccccccccccccccccccccccccccccccccccccccccccccccccccccccccccccc"
      }
    }
  ],
  "refs": {
    "manifest_id": "11111111-1111-4111-8111-111111111111"
  },
  "failure_reason": null,
  "reason": "dry-run contract fixture"
}
